Sector,Note
state improvement,The North Carolina State Improvement Project (NC SIP ). NC SIP is a program in the Exceptional Children Division of the North Carolina Department of Public Instruction (NC DPI). -- Note added 9/15/15 17:19
thank visiting,"Thank you for visiting ACCESSNC, your one-stop source for North Carolina economic data and site information. -- Note added 9/15/15 17:19"
carolina star,"The Carolina Star Program is designed to recognize and promote effective safety and health management systems. In Star, management, labor and OSH establish a cooperative relationship at a workplace that has implemented a strong program. -- Note added 9/15/15 17:20"
nc state,NC state Fair -- Note added 9/15/15 17:20
nc stormwater,NC Stormwater and Runoff pollution site -- Note added 9/15/15 17:22
nc state,NC State Univ Extension  -- Note added 9/15/15 17:22
social work,North Carolina Social Work Certification and Licensure Board -- Note added 9/22/15 14:12
nc symphony,NC Symphony -- Note added 9/15/15 17:22
tobacco free,"Tobacco Free Schools, NC Department of Health and Human Services -- Note added 2/25/14 13:20"
state japan,State of North Carolina Japan Office -- Note added 7/24/13 16:40
nctopps homepage,NC-TOPPS homepage is now http://www.ncdhhs.gov/MHDDSAS/providers/NCTOPPS/index.htm. Entry still included here for nctopps.ncdmh.net pattern for pages such as https://www.google.com/search?q=site%3Anctopps.ncdmh.net. -- Note added 7/23/14 14:41
nc office,NC Office of State Personnel -- Note added 1/14/14 13:06
nc transportation,NC Transportation Museum -- Note added 9/15/15 17:25
department state,North Carolina Department of State Treasurer -- Note added 6/6/13 18:09
veterinary medical,North Carolina Veterinary Medical Board -- Note added 9/15/15 17:30
north carolinas,North Carolina's marketplace for discarded or surplus materials and products. -- Note added 9/15/15 17:31
nc division,NC Division of Water Resources -- Note added 9/15/15 17:31
division water,North Carolina Division of Water Resources -- Note added 11/12/15 12:58
well contractors,"North Carolina Well Contractors Certification Commission - protects the public health and safety by ensuring the integrity and competence of well contractors through examination, certification, continuing education and enforcement. The Well Contractors Certification Unit is now part of the Department of Health and Human Services. -- Note added 11/12/15 12:57"
nc wildlife,nc wildlife resource commission  -- Note added 9/15/15 17:32
nc wiseowl,"NC WiseOwl (NC Online Windows for Learning) has been providing online subscription resources for our schools since 1999.  Our mission is to ensure that all of our public and charter school students have access to a collection of online resources for use in research projects and homework assignments, without regard to the economic status of their local school system.  NC WiseOwl has three major strengths as an educational resource: -- Note added 9/15/15 17:33"
nc zoo,NC Zoo is an agency of the North Carolina Department of Natural and Cultural Resources -- Note added 11/12/15 12:48
league cities,North Dakota League of Cities -- Note added 7/22/14 6:08
department wildlife,Nevada Department of Wildlife -- Note added 1/27/14 20:15
department wildlife,Nevada Department of Wildlife (NDOW) Licensing -- Note added 10/21/13 11:53
recorders information,North Dakota Recorders Information Network -- Note added 7/21/14 6:33
travel tourism,Travel and Tourism Site for North Dakota -- Note added 6/6/13 19:42
ethanol board,Nebraska Ethanol Board -- Note added 12/6/13 19:53
agrelations council,Nebraska AgRelations Council -- Note added 12/6/13 19:45
association transportation,Nebraska Association of Transportation Providers -- Note added 12/6/13 20:02
arts council,"Nebraska Arts Council. The Council is funded by the State of Nebraska, the National Endowment for the Arts, and the Nebraska Cultural Endowment. -- Note added 12/6/13 19:38"
corn board,Nebraska Corn Board -- Note added 12/6/13 19:41
dry bean,Nebraska Dry Bean Commission -- Note added 12/6/13 19:49
state historical,Nebraska State Historical Society -- Note added 12/9/13 18:24
state racing,Nebraska State Racing Commission -- Note added 12/6/13 20:01
wheat board,Nebraska Wheat Board -- Note added 12/6/13 20:06
department economic,Nebraska Department of Economic Development -- Note added 12/6/13 19:50
lottery note,Nebraska Lottery -- Note added 6/12/13 14:18
department transportation,Nevada Department of Transportation -- Note added 6/26/13 15:23
judiciary note,The Nevada Judiciary -- Note added 1/24/14 13:06
travel tourism,Travel and Tourism Site for New Mexico -- Note added 6/6/13 19:42
department community,Pennsylvania Department of Community & Economic Development -- Note added 6/6/13 18:08
forest service,Nebraska Forest Service -- Note added 12/6/13 19:55
nh historical,NH Historical Society -- Note added 9/2/15 19:01
nh municipal,NH Municipal Association -- Note added 9/2/15 19:02
lottery commission,New Hampshire Lottery Commission -- Note added 6/12/13 14:19
nh state,NH State Parks -- Note added 9/2/15 19:03
economic development,New Jersey Economic Development Authority -- Note added 9/16/15 15:52
division fish,"Division of Fish and Wildlife, NJ Department of Environmental Protection -- Note added 6/7/13 11:33"
state library,New Jersey State Library -- Note added 7/26/13 16:17
surcharge violation,New Jersey Surcharge Violation System (NJSVS) -- Note added 9/16/15 15:53
department labor,Department of Labor and Workforce Development   -- Note added 9/16/15 15:53
lottery note,New Mexico Lottery -- Note added 6/12/13 14:20
environmental public,New Mexico Environmental Public Health Tracking -- Note added 10/24/14 12:11
special supplemental,"Special Supplemental Nutrition Program for New Mexico Women, Infants & Children -- Note added 1/10/14 19:17"
nutrition services,"Nutrition Services Branch, Women's and Children's Health, NC Division of Public Health, NCDepartment of Health and Human Services  -- Note added 3/20/14 16:33"
aging disability,"Aging and Disability Services Division, Department of Health and Human Services, State of Nevada -- Note added 6/17/13 15:40"
state conference,New York State Conference of Mayors and Municipal Officials (NYCOM) -- Note added 7/2/15 10:49
historical society,New York Historical Society Museum and Library -- Note added 7/2/15 10:50
state council,New York State Council on the Arts -- Note added 7/2/15 10:51
state egovernment,New York State eGovernment listing of state agencies -- Note added 9/25/13 15:35
state fair,New York State Fair -- Note added 6/12/13 18:48
state homes,New York State Homes and Community Renewal -- Note added 9/9/15 13:48
state local,New York State Local Government IT Directors Association (NYSLGITDA) -- Note added 7/2/15 10:59
state police,New York State Police Recruitment Center -- Note added 1/3/14 13:14
ok corporation,OK Corporation Commission -- Note added 8/28/15 18:20
office hawaiian,"Office of Hawaiian Affairs - 'Under the direction of nine trustees elected statewide, OHA has functioned operationally as both a government agency with a strong degree of autonomy, and as a trust.' -- Note added 6/12/13 13:27"
bureau workers,Ohio Bureau of Workers' Compensation -- Note added 3/26/14 18:21
humanities council,Ohio Humanities Council -- Note added 3/26/14 18:28
lottery note,Ohio Lottery -- Note added 6/12/13 14:22
recorders association,Ohio Recorders' Association -- Note added 3/26/14 18:36
historical society,Oregon Historical Society -- Note added 6/20/14 7:38
ok career,OK career tech website -- Note added 8/28/15 18:21
ok dept,OK dept of human services -- Note added 8/28/15 18:21
oklibshare department,"OKLibShare, Oklahoma Department of Libraries -- Note added 8/27/15 16:00"
ok lp,OK LP Gas commission -- Note added 8/28/15 18:22
state olmstead,State of Virginia Olmstead Initiative -- Note added 8/27/15 14:13
municipal league,Ohio Municipal League -- Note added 3/26/14 18:40
office land,"Office of Land and Water Stewardship, a non-regulatory division within North Carolina's DENR that provides information and assistance to support effective conservation and resilient communities.  -- Note added 11/12/15 12:36"
arts commission,Oregon Arts Commission -- Note added 6/20/14 7:34
governors office,Oregon Governor's Office of Film and Television -- Note added 3/20/14 16:53
lottery note,Oregon Lottery -- Note added 6/12/13 14:22
state fair,Oregon State Fair -- Note added 6/20/14 7:22
resources integration,"The Oklahoma Resources Integration General Information Network System (Origins) is an online database which contains economic, social, and demographic data intended for use by community leaders, educators, businesses, government agencies, and decision makers. -- Note added 8/28/15 18:22"
office state,Office of the State Bank Commissioner of Kansas -- Note added 7/10/14 6:29
ok state,OK State Court System -- Note added 8/28/15 18:23
office state,Office of the Maryland State Prosecutor -- Note added 5/27/14 3:40
division environmental,North Carolina Division of Environmental Assistance and Customer Service   -- Note added 9/15/15 17:43
commonwealth pennsylvanias,Commonwealth of Pennsylvania's media hub -- Note added 6/6/13 18:08
unified judicial,Unified Judicial System of Pennsylvania -- Note added 1/10/14 15:20
pa ehealth,PA eHealth Partnership Authority -- Note added 6/7/13 11:53
firstnet see,Pennsylvania FirstNet. See also http://www.ntia.doc.gov/sligp/pennsylvania.  -- Note added 9/24/14 16:11
republic national,Republic of Palau National Government -- Note added 6/7/13 18:27
judiciary branch,Palau Judiciary Branch -- Note added 5/27/14 15:03
state defense,Georgia State Defense Force public affairs office. Website mirrored on gasdf.com. Referenced on https://ga.ng.mil/Leadership/Georgia-State-Defense-Force/.
parks wildlife,South Dakota Parks & Wildlife Foundation -- Note added 7/17/14 5:50
pa state,PA State System of Higher Education -- Note added 6/7/13 11:53
pa patient,PA Patient Safety Authority -- Note added 6/7/13 11:53
turnpike commission,Pennsylvania Turnpike Commission -- Note added 10/1/14 18:05
pa health,PA Health Care Cost Containment Council -- Note added 6/7/13 11:53
pa higher,PA Higher Education Assistance Agency -- Note added 6/7/13 11:53
pa higher,PA Higher Educational Facilities Authority -- Note added 6/7/13 11:53
pa housing,PA Housing Finance Agency -- Note added 6/7/13 11:53
pat harrison,"Pat Harrison Waterway District (PHWD), a Mississippi State Agency that provides camping, cabins and recreational facilities in Mississippi -- Note added 1/13/14 20:28"
ports authority,South Carolina Ports Authority -- Note added 6/6/13 18:08
port note,The Port of Virginia -- Note added 7/14/14 17:09
state potato,Washington State Potato Commission -- Note added 11/17/14 7:11
historical commission,"Alabama Historical Commission, State of Alabama Historic Preservation Office -- Note added 7/15/13 18:19"
queen annes,"Queen Anne's Revenge, a project of the http://www.qaronline.org/ North Carolina Department of Cultural Resources to educate the next generation on colonial life -- Note added 11/20/13 17:34"
uninsured employers,"Uninsured Employers' Fund, State of Maryland -- Note added 11/20/13 17:37"
ok state,OK State AG Econ at OSU -- Note added 8/28/15 18:25
ready nc,"Ready NC, NC Department of Public Safety -- Note added 1/14/14 14:35"
ready pa,"Ready PA, Pennsylvania Emergency Management Agency -- Note added 4/16/14 15:38"
red raspberry,Washington Red Raspberry Commission -- Note added 11/17/14 7:07
state board,The State Board of Refrigeration Examiners -- Note added 9/15/15 17:47
division vocational,Division of Vocational Rehabilitation - Florida Department of Education -- Note added 7/1/15 18:43
clean water,Rhode Island Clean Water Finance Agency -- Note added 1/27/14 19:35
emissions safety,Rhode Island Emissions and Safety Testing -- Note added 1/7/14 18:45
lottery note,Rhode Island Lottery -- Note added 6/7/13 18:46
public utilities,Rhode Island Public Utilities Commission -- Note added 1/29/14 15:24
turnpike bridge,Rhode Island Turnpike and Bridge Authority -- Note added 1/27/14 15:54
office president,"Office of the President, Republic of the Marshall Islands -- Note added 6/12/13 13:31"
safemt resource,"SafeMT, a resource of the Montana State Fund for safety in Montana's workplaces. -- Note added 11/18/13 16:35"
nc safe,NC Safe Haven Law - Abandoned Infant Protection Law Site -- Note added 9/15/15 17:54
website center,"The website of the Virginia Center on Aging (VCoA), a statewide agency created by the Virginia General Assembly and housed at Virginia Commonwealth University in the School of Allied Health Professions. VCoA works to protect and improve the quality of life of older Virginians, so that they might remain interdependent and contributing members to life in Virginia. -- Note added 6/27/14 14:23"
santee cooper,"Santee Cooper, also known officially from the 1930s as the South Carolina Public Service Authority, is South Carolina's state-owned electric and water utility that came into being during the New Deal. -- Note added 8/25/14 16:04"
office state,New Mexico Office of the State Auditor -- Note added 7/16/14 5:38
save water,Save Water NC -- Note added 11/12/15 12:34
state board,"Florida State Board of Administration, created by the Florida Constitution and is governed by a three-member Board of Trustees (Trustees), comprised of the Governor as Chair, the Chief Financial Officer and the Attorney General. -- Note added 8/25/14 16:59"
state board,Washington State Board for Community and Technical Colleges -- Note added 4/8/14 18:22
state college,"State College Borough Water Authority, PA -- Note added 10/1/14 20:16"
sc dept,SC dept of commerce -- Note added 8/28/15 15:19
sc judicial,SC judicial courts -- Note added 8/28/15 15:19
sc dmv,SC DMV -- Note added 8/28/15 15:20
education lottery,South Carolina Education Lottery -- Note added 6/12/13 14:24
emergency management,South Carolina Emergency Management Division -- Note added 8/28/15 15:20
sc early,SC early childhood education program -- Note added 8/28/15 15:20
sc gov,SC Gov Mansion  -- Note added 8/28/15 15:23
sc govoners,SC govoners school for science and math -- Note added 8/28/15 15:23
sc national,SC National Guard -- Note added 8/28/15 15:24
state council,"The State Council of Higher Education for Virginia (SCHEV) makes higher education public policy recommendations to the Governor and General Assembly in such areas as capital and operating budget planning, enrollment projections, institutional technology needs, and student financial aid. -- Note added 6/27/14 14:25"
school planning,"School Planning Section, North Carolina Department of Public Instruction -- Note added 8/25/14 15:01"
independent living,South Carolina Independent Living Council (SCILC) -- Note added 9/22/15 15:16
independent living,South Carolina Independent Living Council (SCILC) -- Note added 9/22/15 15:17
epscoridea program,"The South Carolina EPSCoR/IDeA Program, CCCR COBRE, and the USC School of Medicine Instrumentation Resource Facility -- Note added 8/28/15 15:28"
sc malpractice,SC malpractice patient compensation fund -- Note added 8/28/15 15:27
school deaf,South Carolina School for the Deaf and Blind -- Note added 8/25/14 15:03
statewide independent,South Carolina Statewide Independent Living Council (SILC) -- Note added 9/22/15 15:19
sc sec,SC sec of state -- Note added 8/28/15 15:29
department revenue,South Carolina Department of Revenue -- Note added 8/25/14 15:04
higher educationtuition,South Carolina Higher EducationTuition Grants Commission -- Note added 8/28/15 15:30
sc state,SC State Election Committee -- Note added 8/28/15 15:30
sc vocab,SC Vocab Rehab -- Note added 8/28/15 15:31
department transportation,South Dakota Department of Transportation -- Note added 7/17/14 5:53
housing development,South Dakota Housing Development Authority -- Note added 7/17/14 5:54
state employees,STATE EMPLOYEES ASSOCIATION OF NORTH CAROLINA -- Note added 9/15/15 17:56
seeking online,"Seeking Michigan, the online platform for the http://michigan.gov/mhc Michigan Historical Center. It includes http://www.michigan.gov/archivesofmi Archives of Michigan research guides and indexes, a blog, and educator resources&ndash;all from the Michigan Historical Center and Archives of Michigan staff. -- Note added 7/9/14 12:06"
senate note,Minnesota Senate -- Note added 11/9/15 20:36
authorized service,"Authorized Service Website for the Arizona Department of Transportation, Motor Vehicle Division -- Note added 1/10/14 19:17"
state port,Mississippi State Port Authority -- Note added 7/25/14 20:50
state health,North Carolina State Health Plan for Teachers and State Employees -- Note added 7/25/14 15:10
sled statewide,SLED (Statewide Library Electronic Doorway) -- Note added 6/6/13 18:08
state laboratory,"State Laboratory of Public Health, NC Division of Public Health -- Note added 7/26/13 15:11"
science museum,"Science Museum of Virginia, located in Richmond, VA -- Note added 7/11/14 18:43"
nc secretary,NC Secretary Of State -- Note added 9/15/15 17:58
arts commission,south carolina arts commission -- Note added 8/28/15 15:32
historical society,south carolina historical society -- Note added 8/28/15 15:32
pa state,PA State Public School Building Authority -- Note added 6/7/13 11:53
susquehanna river,"Susquehanna River Basin Commission -¬†The Susquehanna River Basin Compact, was signed into law on December 24, 1970. The Compact, as adopted by the Congress of the United States, and the legislatures of New York State, Pennsylvania and Maryland, provides the mechanism to guide the conservation, development, and administration of the water resources of the vast river basin. -- Note added 6/26/13 16:30"
start squad,"Start Squad, kid's portal to the State Library of North Carolina -- Note added 8/25/14 12:12"
north carolinas,North Carolina's Justus-Warren Heart Disease and Stroke Prevention Task Force -- Note added 11/10/15 20:35
stateakus pattern,"*state.ak.us pattern to include Alaska state agencies, such as those at: https://www.google.com/#q=site:state.ak.us  -- Note added 7/8/14 12:25"
statealus pattern,"*state.al.us pattern to include Alabama state agencies, such as those at: https://www.google.com/#q=site:state.al.us  -- Note added 7/8/14 12:26"
statearus pattern,*state.ar.us pattern for State of Arkansas agencies -- Note added 7/17/13 19:01
stateazus pattern,"*state.az.us pattern to include Arizona state agencies, such as those at https://www.google.com/#q=site:state.az.us.  -- Note added 12/13/13 13:17"
statecaus pattern,"*state.ca.us pattern to include California state agencies, such as those at: https://www.google.com/#q=site:state.ca.us  -- Note added 6/27/14 16:14"
included find,"Included to find *.state.co.us pattern to find state websites, such as https://www.google.com/search?q=site%3Astate.co.us  -- Note added 1/14/14 15:07"
stateflus pattern,"*state.fl.us pattern to include Florida state agencies, such as those at: https://www.google.com/#q=site:state.fl.us   -- Note added 6/27/14 16:15"
state ga,State of Ga website -- Note added 8/25/15 16:09
state note,State of Iowa -- Note added 8/26/15 13:51
pattern stateidus,Pattern for *state.id.us websites -- Note added 7/8/13 19:27
state note,State of Illinois -- Note added 7/3/14 17:38
state note,state of  Indiana -- Note added 8/27/15 14:57
ky website,Ky Website -- Note added 8/27/15 16:57
state library,State Library of Louisiana -- Note added 7/26/13 16:18
mass state,Mass State Website -- Note added 8/26/15 16:22
state website,"State website is at http://www.maryland.gov. state.md.us pattern to include Maryland state agencies, such as those at https://www.google.com/#q=site:state.md.us. -- Note added 7/23/14 16:07"
state note,state of maine -- Note added 8/27/15 20:01
state note,state of michigan -- Note added 9/3/15 16:11
minnesotagov portal,Minnesota.gov portal; 'electronic entry point to Minnesota State government information and services' -- Note added 6/2/15 1:37
state note,State of Mississippi -- Note added 7/8/14 12:53
stateneus pattern,*.state.ne.us pattern to include several state agencies. -- Note added 12/9/13 18:31
nh state,NH State Website -- Note added 9/2/15 19:11
httpwwwstatenjus httpwwwnjgov,"http://www.state.nj.us/ and http://www.nj.gov both resolve to the same site. n*state.nj.us pattern to include New Jersey state agencies, such as those at: https://www.google.com/#q=site:state.nj.us  -- Note added 7/8/14 13:04"
state note,State of New Mexico -- Note added 7/16/14 5:42
state note,State of Ohio -- Note added 3/27/14 18:36
state ok,State of OK website -- Note added 8/28/15 18:27
httpwwwstateorus resolves,"http://www.state.or.us/ resolves to a non-styled version of http://www.oregon.gov/  n*state.or.us pattern included here to find State of Oregon agencies, such as: https://www.google.com/search?q=site:state.or.us -- Note added 7/17/14 17:40"
state sc,State of SC  -- Note added 8/28/15 15:35
state government,South Dakota State Government Website -- Note added 7/17/14 6:01
official site,Official site of the Tennessee Government -- Note added 6/26/14 13:27
official website,The official website of the Commonwealth of Virginia -- Note added 6/27/14 14:50
state note,State of Vermont -- Note added 8/15/14 14:27
state note,State of Washington -- Note added 11/17/14 6:48
statewius pattern,"*.state.wi.us pattern is included here for various Department-level agencies, such as those at: https://www.google.com/search?q=site%3Astate.wi.us  Requires 'www' to resolve. -- Note added 4/2/14 12:49"
state travel,State of Wyoming travel and tourism website -- Note added 7/23/14 5:34
state fair,Nebraska State Fair -- Note added 12/6/13 19:53
staten island,"Staten Island Borough President, New York, NY -- Note added 11/20/13 18:23"
nc division,NC Division of Surplus Property -- Note added 9/15/15 18:02
nc sustainability,NC sustainability connection -- Note added 9/15/15 18:06
welcome dedicated,"Welcome to Teach4NC, dedicated to the recruitment of teaching professionals for public schools in North Carolina. -- Note added 9/15/15 18:19"
holocaust commission,Tennessee Holocaust Commission -- Note added 6/26/14 7:22
state bar,State Bar of Texas -- Note added 6/20/14 16:58
foreign language,Tennessee Foreign Language Institute -- Note added 6/26/14 7:21
housing development,Tennessee Housing Development Agency -- Note added 6/26/14 7:19
cabinet economic,kentucky cabinet of economic development -- Note added 8/27/15 16:58
municipal retirement,Texas Municipal Retirement System (TMRS)  -- Note added 8/18/14 16:14
district attorneys,Tennessee District Attorneys General Conference -- Note added 6/26/14 7:16
emergency management,Tennessee Emergency Management Agency -- Note added 6/26/14 7:15
lottery note,Lottery Tennessee -- Note added 6/12/13 14:26
national guard,Tennessee National Guard -- Note added 6/26/14 7:13
vacation travel,"Tennessee Vacation, the travel and tourism site for the state of Tennessee -- Note added 8/18/14 15:23"
parks wildlife,Texas Parks and Wildlife magazine -- Note added 3/20/14 16:35
travel tourism,Travel and Tourism Site for Alaska -- Note added 6/6/13 19:44
travel tourism,Travel and Tourism Site for Iowa -- Note added 6/6/13 19:44
travel tourism,Travel and Tourism Site for Kansas -- Note added 6/6/13 19:44
travel tourism,Travel and Tourism Sites for Nevada -- Note added 6/6/13 19:11
travel tourism,Travel and Tourism Sites for Oklahoma -- Note added 6/6/13 19:11
travel tourism,"Travel and Tourism Site for Oregon, Oregon Tourism Commission -- Note added 7/23/14 16:09"
travel tourism,Travel and Tourism Sites for South Dakota -- Note added 6/6/13 19:11
travel tourism,Travel and Tourism Sites for Texas -- Note added 6/6/13 19:11
travel tourism,Travel and Tourism Sites for Wisconsin -- Note added 6/6/13 19:11
state treasurer,Nebraska State Treasurer -- Note added 12/6/13 20:03
tree fruit,Washington Tree Fruit Research Commission -- Note added 11/12/14 6:37
state tobacco,Washington State Tobacco Settlement Authority -- Note added 4/8/14 18:29
lottery note,Texas Lottery -- Note added 6/12/13 14:26
university division,"University of Arkansas, Division of AgricultureResearch & Extension, University of Arkansas System Arkansas Cooperative Extension Service -- Note added 12/10/14 7:11"
university fairbanks,University of Alaska Fairbanks Cooperative Extension Service -- Note added 6/7/13 16:34
university extension,University of Idaho Extension -- Note added 7/8/13 14:29
us bureau,U.S. Virgin Islands Bureau of Economic Research -- Note added 8/18/14 14:14
us economic,U.S. Virgin Islands Economic Development Authority -- Note added 8/18/14 14:12
university extension,University of Vermont Extension -- Note added 8/18/14 5:33
university wisconsinextension,University of Wisconsin-Extension -- Note added 8/12/14 5:36
university cooperative,University of Wyoming Cooperative Extension Service -- Note added 7/23/14 5:39
state rehabilitation,Virginia State Rehabilitation Council (SRC) -- Note added 8/27/15 14:12
association assessing,"The Virginia Association of Assessing Officers is a professional organization of assessors and appraisers from state and local governments throughout the Commonwealth. The organization's mission is to improve assessment standards, disseminate information on assessment practices, and provide continuing education to its members. -- Note added 7/11/14 18:56"
board people,Virginia Board for People with Disabilities -- Note added 7/11/14 18:57
commonwealth neurotrauma,Virginia Commonwealth Neurotrauma Initiative (CNI) Trust Fund -- Note added 9/3/15 11:28
department aging,Virginia Department for Aging and Rehabilitative Services -- Note added 8/27/15 14:22
department aging,Virginia Department for Aging and Rehabilitative Services -- Note added 6/6/13 18:09
disability services,Virginia Disability Services Agencies -- Note added 7/14/14 16:54
