Sector,Note
virginia commonwealth,Virginia Commonwealth Neurotrauma Initiative (CNI) Trust Fund -- Note added 9/3/15 11:28
virginia department,Virginia Department for Aging and Rehabilitative Services -- Note added 8/27/15 14:22
virginia department,Virginia Department for Aging and Rehabilitative Services -- Note added 6/6/13 18:09
virginia disability,Virginia Disability Services Agencies -- Note added 7/14/14 16:54
virginia department,Virginia Department of Fire Programs -- Note added 6/12/13 18:15
virginia lottery,Virginia Lottery -- Note added 6/12/13 14:27
virginia statewide,Virginia Statewide Independent Living Council -- Note added 9/3/15 11:14
virginia assistive,Virginia Assistive Technology System -- Note added 7/11/14 19:06
virginia career,Virginia Career Education Foundation is a non-profit organization that works to increase the number of qualified applicants available to fill technical positions throughout the Commonwealth of Virginia. -- Note added 7/11/14 19:07
virginia department,Virginia Department for the Blind and Vision Impaired -- Note added 7/11/14 19:09
virginia department,Virginia Department for the Deaf and Hard of Hearing (VDDHH) -- Note added 7/11/14 19:09
state vendor,State of North Carolina's Vendor Registration -- Note added 1/14/14 13:04
vermont arts,Vermont Arts Council -- Note added 8/18/14 5:35
vermont historical,Vermont Historical Society -- Note added 8/18/14 5:36
travel tourism,Travel and Tourism Site for Vermont -- Note added 6/6/13 19:19
virginia housing,Virginia Housing Development Authority -- Note added 7/11/14 19:10
vermont housing,Vermont Housing Finance Agency -- Note added 8/18/14 5:37
virginia horse,The Virginia Horse Industry Board is responsible for the promotion and economic development of the horse industry in Virginia and operates through the Virginia Department of Agriculture and Consumer Services. -- Note added 7/11/14 19:12
virginia industries,"Virginia Industries for the Blind, Commonwealth of Virginia -- Note added 9/3/15 11:46"
virgin islands,Virgin Islands Department of Education -- Note added 8/18/14 14:08
office virgin,Office of the Virgin Islands Inspector General -- Note added 8/18/14 14:13
virgin islands,U.S. Virgin Islands Police Department -- Note added 8/18/14 14:16
travel tourism,Travel and Tourism Sites for Virginia -- Note added 6/6/13 19:11
virginia college,Virginia College Savings Plan -- Note added 7/11/14 19:18
virginia economic,Virginia Economic Development Partnership's Ally Information Exchange -- Note added 7/11/14 20:17
virginia department,Virginia Department of Transportation -- Note added 7/11/14 20:18
virginia resources,Virginia Resources Authority -- Note added 7/11/14 20:19
travel tourism,Travel and Tourism Site for California -- Note added 8/27/13 12:59
california welcome,California Welcome Centers -- Note added 8/27/13 12:58
travel tourism,Travel and Tourism Sites for Delaware -- Note added 6/6/13 19:11
travel tourism,Travel and Tourism Site for Florida -- Note added 6/6/13 19:15
travel tourism,Travel and Tourism Sites for Guam -- Note added 6/6/13 19:11
travel tourism,Travel and Tourism Site for Idaho -- Note added 6/6/13 19:48
travel tourism,Travel and Tourism Sites for Maine -- Note added 6/6/13 19:11
travel tourism,Travel and Tourism Site for Maryland -- Note added 6/6/13 19:17
travel tourism,Travel and Tourism Sites for Mississippi -- Note added 6/6/13 19:11
travel tourism,Travel and Tourism Site for Missouri -- Note added 6/6/13 19:34
travel tourism,Travel and Tourism Site for Montana -- Note added 6/6/13 19:33
travel tourism,Travel and Tourism Site for North Carolina -- Note added 6/6/13 19:33
travel tourism,Travel and Tourism Site for Nebraska -- Note added 6/6/13 19:33
travel tourism,Travel and Tourism Site for Pennsylvania -- Note added 6/6/13 19:32
travel tourism,Travel and Tourism Site for Rhode Island -- Note added 6/6/13 19:32
travel tourism,Travel and tourism site for the US Virgin Islands -- Note added 6/6/13 19:47
travel tourism,Travel and Tourism Site for Utah -- Note added 6/6/13 19:31
supreme court,Supreme Court of the United States Virgin Islands -- Note added 8/18/14 14:06
viva florida,"Viva Florida 500 is a statewide initiative led by the Florida Department of State, under the leadership of Governor Rick Scott, to highlight the 500 years of historic people, places and events in present-day Florida since the arrival of Juan Ponce de Leon to the land he named La Florida in 1513. See more at http://www.vivaflorida.org/About-Viva-Florida/ -- Note added 7/23/14 14:01"
virginia museum,"Virginia Museum of Natural History in Martinsville, VA -- Note added 7/11/14 20:20"
florida governors,Florida Governor's Commission on Volunteerism and Community Service -- Note added 11/9/15 19:00
volunteer mississippi,"Volunteer Mississippi, A Mississippi Commission for Volunteer Service (MCVS) -- Note added 7/28/14 14:58"
north carolina,North Carolina Commission on Volunteerism and Community Service -- Note added 11/10/15 20:34
virginia rehabilitation,Virginia Rehabilitation Center for the Blind and Vision Impaired -- Note added 8/27/15 15:09
virginia rural,Virginia Rural Water Association -- Note added 7/23/13 19:42
virginia state,Virginia State Bar -- Note added 7/11/14 20:21
vermont national,Vermont National Guard -- Note added 1/23/14 14:03
vermont lottery,Vermont Lottery -- Note added 6/12/13 14:27
washington blueberry,Washington Blueberry Commission -- Note added 11/12/14 6:30
washington hardwoods,Washington Hardwoods Commission -- Note added 11/12/14 6:29
washington state,Washington State Lottery -- Note added 12/2/14 7:23
washington state,Washington State Seed Potato Commission -- Note added 11/12/14 6:26
travel tourism,Travel and Tourism Site for the District of Columbia -- Note added 6/6/13 19:31
washington air,Washington Air National Guard -- Note added 1/3/14 13:08
washington army,Washington Army National Guard -- Note added 1/23/14 14:03
washington national,Washington National Guard -- Note added 1/23/14 14:03
washington state,Washington State Wine Commission -- Note added 11/12/14 6:23
washington association,Washington Association of Sheriffs and Police Chiefs -- Note added 11/12/14 6:22
waterparkin website,"Waterparkin', a website of the Pat Harrison Waterway District (PHWD) a Mississippi State Agency that provides camping, cabins and recreational facilities in Mississippi. See historical snaphot at: http://web.archive.org/web/20101224004547/http://waterparkin.com/  -- Note added 1/13/14 20:28"
way lived,"The Way We Lived in North Carolina, presented by http://www.ah.dcr.state.nc.us/ The North Carolina Office of Archives & History. -- Note added 8/13/14 17:41"
state wisconsin,State of Wisconsin Department of Financial Institutions -- Note added 8/11/14 5:34
university rhode,University of Rhode Island Cooperative Extension -- Note added 6/7/13 18:31
washington economic,Washington Economic Development Finance Authority -- Note added 11/12/14 6:21
womens health,"Women's Health Branch, NC Division of Public Health -- Note added 7/26/13 15:11"
wisconsin housing,Wisconsin Housing and Economic Development Authority -- Note added 8/11/14 5:30
washington higher,Washington Higher Education Facilities Authority -- Note added 4/8/14 18:33
oklahoma department,Oklahoma Department of Wildlife Conservation - http://www.wildlifedepartment.com/  -- Note added 10/29/13 15:11
wisconsin lottery,Wisconsin Lottery -- Note added 6/12/13 14:28
virgin islands,Virgin Islands Lottery -- Note added 6/12/13 14:29
wisconsin historical,Wisconsin Historical Society -- Note added 8/11/14 5:26
wisconsin state,Wisconsin State Public Defender's Office -- Note added 6/14/13 17:38
register deeds,Register of Deeds Association of Wisconsin -- Note added 8/11/14 5:23
dept health,"NC Dept of Health and Human services, division of State operated healthcare facilities -- Note added 9/14/15 20:51"
washington state,Washington State Convention Center -- Note added 11/6/14 7:30
washington state,Washington State Commission on Pesticide Registration -- Note added 11/6/14 7:32
washington state,Washington State Housing Finance Commission -- Note added 11/6/14 7:27
washington state,Washington State School for the Blind -- Note added 7/31/13 16:31
west virginia,West Virginia Department of Agriculture -- Note added 3/31/14 13:07
west virginia,West Virginia Department of Commerce -- Note added 3/24/14 16:50
west virginia,West Virginia Division of Culture and History -- Note added 3/31/14 13:08
west virginia,West Virginia Department of Health and Human Resources -- Note added 7/24/14 5:50
west virginia,West Virginia Housing Development Fund -- Note added 7/24/14 5:51
west virginia,West Virginia Higher Education Policy Commission -- Note added 3/31/14 13:12
west virginia,"West Virginia Department of Commerce, Division of Labor -- Note added 7/24/14 5:52"
west virginia,West Virginia Lottery -- Note added 6/12/13 14:29
west virginia,West Virginia Network for Educational Telecomputing -- Note added 7/24/14 5:54
west virginia,West Virginia Consolidated Public Retirement Board -- Note added 3/31/14 13:33
west virginia,West Virginia State Parks -- Note added 3/31/14 13:34
west virginia,West Virginia State Treasurer's Office -- Note added 3/31/14 13:35
travel tourism,Travel and Tourism Site for West Virginia -- Note added 6/6/13 19:18
west virginia,West Virginia Water Development Authority -- Note added 7/24/14 5:57
montana army,Montana Army National Guard -- Note added 3/2/15 6:52
wyoming business,Wyoming Business Council -- Note added 6/7/13 16:41
travel tourism,Travel and Tourism Site for Wyoming -- Note added 6/6/13 19:31
virginia economic,"Virginia Economic Development Partnership. As a state authority, the Partnership is governed by a 25 member http://yesvirginia.org/AboutUs/BoardOfDirectors Board Of Directors comprised of businesspersons from around Virginia, each of whom is appointed by the http://www.governor.virginia.gov Governor and the General Assembly.  -- Note added 11/20/13 18:52"
