Sector,Note
north carolina,North Carolina Seniors' Health Insurance Information Program (SHIIP) -- Note added 1/22/14 19:19
north carolina,"North Carolina Sickle Cell Syndrome Program, NC Department of Public Health -- Note added 11/12/15 13:09"
north carolina,The North Carolina State Improvement Project (NC SIP ). NC SIP is a program in the Exceptional Children Division of the North Carolina Department of Public Instruction (NC DPI). -- Note added 9/15/15 17:19
thank visiting,"Thank you for visiting ACCESSNC, your one-stop source for North Carolina economic data and site information. -- Note added 9/15/15 17:19"
carolina star,"The Carolina Star Program is designed to recognize and promote effective safety and health management systems. In Star, management, labor and OSH establish a cooperative relationship at a workplace that has implemented a strong program. -- Note added 9/15/15 17:20"
state fair,NC state Fair -- Note added 9/15/15 17:20
stormwater runoff,NC Stormwater and Runoff pollution site -- Note added 9/15/15 17:22
state univ,NC State Univ Extension  -- Note added 9/15/15 17:22
north carolina,North Carolina Social Work Certification and Licensure Board -- Note added 9/22/15 14:12
symphony note,NC Symphony -- Note added 9/15/15 17:22
tobacco free,"Tobacco Free Schools, NC Department of Health and Human Services -- Note added 2/25/14 13:20"
state north,State of North Carolina Japan Office -- Note added 7/24/13 16:40
nctopps homepage,NC-TOPPS homepage is now http://www.ncdhhs.gov/MHDDSAS/providers/NCTOPPS/index.htm. Entry still included here for nctopps.ncdmh.net pattern for pages such as https://www.google.com/search?q=site%3Anctopps.ncdmh.net. -- Note added 7/23/14 14:41
office state,NC Office of State Personnel -- Note added 1/14/14 13:06
transportation museum,NC Transportation Museum -- Note added 9/15/15 17:25
north carolina,North Carolina Department of State Treasurer -- Note added 6/6/13 18:09
north carolina,North Carolina Veterinary Medical Board -- Note added 9/15/15 17:30
marketplace discarded,North Carolina's marketplace for discarded or surplus materials and products. -- Note added 9/15/15 17:31
division water,NC Division of Water Resources -- Note added 9/15/15 17:31
north carolina,North Carolina Division of Water Resources -- Note added 11/12/15 12:58
north carolina,"North Carolina Well Contractors Certification Commission - protects the public health and safety by ensuring the integrity and competence of well contractors through examination, certification, continuing education and enforcement. The Well Contractors Certification Unit is now part of the Department of Health and Human Services. -- Note added 11/12/15 12:57"
wildlife resource,nc wildlife resource commission  -- Note added 9/15/15 17:32
wiseowl online,"NC WiseOwl (NC Online Windows for Learning) has been providing online subscription resources for our schools since 1999.  Our mission is to ensure that all of our public and charter school students have access to a collection of online resources for use in research projects and homework assignments, without regard to the economic status of their local school system.  NC WiseOwl has three major strengths as an educational resource: -- Note added 9/15/15 17:33"
zoo agency,NC Zoo is an agency of the North Carolina Department of Natural and Cultural Resources -- Note added 11/12/15 12:48
north dakota,North Dakota League of Cities -- Note added 7/22/14 6:08
nevada department,Nevada Department of Wildlife -- Note added 1/27/14 20:15
nevada department,Nevada Department of Wildlife (NDOW) Licensing -- Note added 10/21/13 11:53
north dakota,North Dakota Recorders Information Network -- Note added 7/21/14 6:33
travel tourism,Travel and Tourism Site for North Dakota -- Note added 6/6/13 19:42
nebraska ethanol,Nebraska Ethanol Board -- Note added 12/6/13 19:53
nebraska agrelations,Nebraska AgRelations Council -- Note added 12/6/13 19:45
nebraska association,Nebraska Association of Transportation Providers -- Note added 12/6/13 20:02
nebraska arts,"Nebraska Arts Council. The Council is funded by the State of Nebraska, the National Endowment for the Arts, and the Nebraska Cultural Endowment. -- Note added 12/6/13 19:38"
nebraska corn,Nebraska Corn Board -- Note added 12/6/13 19:41
nebraska dry,Nebraska Dry Bean Commission -- Note added 12/6/13 19:49
nebraska state,Nebraska State Historical Society -- Note added 12/9/13 18:24
nebraska state,Nebraska State Racing Commission -- Note added 12/6/13 20:01
nebraska wheat,Nebraska Wheat Board -- Note added 12/6/13 20:06
nebraska department,Nebraska Department of Economic Development -- Note added 12/6/13 19:50
nebraska lottery,Nebraska Lottery -- Note added 6/12/13 14:18
nevada department,Nevada Department of Transportation -- Note added 6/26/13 15:23
nevada judiciary,The Nevada Judiciary -- Note added 1/24/14 13:06
travel tourism,Travel and Tourism Site for New Mexico -- Note added 6/6/13 19:42
pennsylvania department,Pennsylvania Department of Community & Economic Development -- Note added 6/6/13 18:08
nebraska forest,Nebraska Forest Service -- Note added 12/6/13 19:55
historical society,NH Historical Society -- Note added 9/2/15 19:01
municipal association,NH Municipal Association -- Note added 9/2/15 19:02
new hampshire,New Hampshire Lottery Commission -- Note added 6/12/13 14:19
state parks,NH State Parks -- Note added 9/2/15 19:03
new jersey,New Jersey Economic Development Authority -- Note added 9/16/15 15:52
division fish,"Division of Fish and Wildlife, NJ Department of Environmental Protection -- Note added 6/7/13 11:33"
new jersey,New Jersey State Library -- Note added 7/26/13 16:17
new jersey,New Jersey Surcharge Violation System (NJSVS) -- Note added 9/16/15 15:53
department labor,Department of Labor and Workforce Development   -- Note added 9/16/15 15:53
new mexico,New Mexico Lottery -- Note added 6/12/13 14:20
new mexico,New Mexico Environmental Public Health Tracking -- Note added 10/24/14 12:11
special supplemental,"Special Supplemental Nutrition Program for New Mexico Women, Infants & Children -- Note added 1/10/14 19:17"
nutrition services,"Nutrition Services Branch, Women's and Children's Health, NC Division of Public Health, NCDepartment of Health and Human Services  -- Note added 3/20/14 16:33"
aging disability,"Aging and Disability Services Division, Department of Health and Human Services, State of Nevada -- Note added 6/17/13 15:40"
new york,New York State Conference of Mayors and Municipal Officials (NYCOM) -- Note added 7/2/15 10:49
new york,New York Historical Society Museum and Library -- Note added 7/2/15 10:50
new york,New York State Council on the Arts -- Note added 7/2/15 10:51
new york,New York State eGovernment listing of state agencies -- Note added 9/25/13 15:35
new york,New York State Fair -- Note added 6/12/13 18:48
new york,New York State Homes and Community Renewal -- Note added 9/9/15 13:48
new york,New York State Local Government IT Directors Association (NYSLGITDA) -- Note added 7/2/15 10:59
new york,New York State Police Recruitment Center -- Note added 1/3/14 13:14
corporation commission,OK Corporation Commission -- Note added 8/28/15 18:20
office hawaiian,"Office of Hawaiian Affairs - 'Under the direction of nine trustees elected statewide, OHA has functioned operationally as both a government agency with a strong degree of autonomy, and as a trust.' -- Note added 6/12/13 13:27"
ohio bureau,Ohio Bureau of Workers' Compensation -- Note added 3/26/14 18:21
ohio humanities,Ohio Humanities Council -- Note added 3/26/14 18:28
ohio lottery,Ohio Lottery -- Note added 6/12/13 14:22
ohio recorders,Ohio Recorders' Association -- Note added 3/26/14 18:36
oregon historical,Oregon Historical Society -- Note added 6/20/14 7:38
career tech,OK career tech website -- Note added 8/28/15 18:21
dept human,OK dept of human services -- Note added 8/28/15 18:21
oklibshare oklahoma,"OKLibShare, Oklahoma Department of Libraries -- Note added 8/27/15 16:00"
gas commission,OK LP Gas commission -- Note added 8/28/15 18:22
state virginia,State of Virginia Olmstead Initiative -- Note added 8/27/15 14:13
ohio municipal,Ohio Municipal League -- Note added 3/26/14 18:40
office land,"Office of Land and Water Stewardship, a non-regulatory division within North Carolina's DENR that provides information and assistance to support effective conservation and resilient communities.  -- Note added 11/12/15 12:36"
oregon arts,Oregon Arts Commission -- Note added 6/20/14 7:34
oregon governors,Oregon Governor's Office of Film and Television -- Note added 3/20/14 16:53
oregon lottery,Oregon Lottery -- Note added 6/12/13 14:22
oregon state,Oregon State Fair -- Note added 6/20/14 7:22
oklahoma resources,"The Oklahoma Resources Integration General Information Network System (Origins) is an online database which contains economic, social, and demographic data intended for use by community leaders, educators, businesses, government agencies, and decision makers. -- Note added 8/28/15 18:22"
office state,Office of the State Bank Commissioner of Kansas -- Note added 7/10/14 6:29
state court,OK State Court System -- Note added 8/28/15 18:23
office maryland,Office of the Maryland State Prosecutor -- Note added 5/27/14 3:40
north carolina,North Carolina Division of Environmental Assistance and Customer Service   -- Note added 9/15/15 17:43
commonwealth media,Commonwealth of Pennsylvania's media hub -- Note added 6/6/13 18:08
unified judicial,Unified Judicial System of Pennsylvania -- Note added 1/10/14 15:20
ehealth partnership,PA eHealth Partnership Authority -- Note added 6/7/13 11:53
pennsylvania firstnet,Pennsylvania FirstNet. See also http://www.ntia.doc.gov/sligp/pennsylvania.  -- Note added 9/24/14 16:11
republic palau,Republic of Palau National Government -- Note added 6/7/13 18:27
palau judiciary,Palau Judiciary Branch -- Note added 5/27/14 15:03
georgia state,Georgia State Defense Force public affairs office. Website mirrored on gasdf.com. Referenced on https://ga.ng.mil/Leadership/Georgia-State-Defense-Force/.
south dakota,South Dakota Parks & Wildlife Foundation -- Note added 7/17/14 5:50
state system,PA State System of Higher Education -- Note added 6/7/13 11:53
patient safety,PA Patient Safety Authority -- Note added 6/7/13 11:53
pennsylvania turnpike,Pennsylvania Turnpike Commission -- Note added 10/1/14 18:05
health care,PA Health Care Cost Containment Council -- Note added 6/7/13 11:53
higher education,PA Higher Education Assistance Agency -- Note added 6/7/13 11:53
higher educational,PA Higher Educational Facilities Authority -- Note added 6/7/13 11:53
housing finance,PA Housing Finance Agency -- Note added 6/7/13 11:53
pat harrison,"Pat Harrison Waterway District (PHWD), a Mississippi State Agency that provides camping, cabins and recreational facilities in Mississippi -- Note added 1/13/14 20:28"
south carolina,South Carolina Ports Authority -- Note added 6/6/13 18:08
port virginia,The Port of Virginia -- Note added 7/14/14 17:09
washington state,Washington State Potato Commission -- Note added 11/17/14 7:11
alabama historical,"Alabama Historical Commission, State of Alabama Historic Preservation Office -- Note added 7/15/13 18:19"
queen annes,"Queen Anne's Revenge, a project of the http://www.qaronline.org/ North Carolina Department of Cultural Resources to educate the next generation on colonial life -- Note added 11/20/13 17:34"
uninsured employers,"Uninsured Employers' Fund, State of Maryland -- Note added 11/20/13 17:37"
state econ,OK State AG Econ at OSU -- Note added 8/28/15 18:25
ready department,"Ready NC, NC Department of Public Safety -- Note added 1/14/14 14:35"
ready pennsylvania,"Ready PA, Pennsylvania Emergency Management Agency -- Note added 4/16/14 15:38"
washington red,Washington Red Raspberry Commission -- Note added 11/17/14 7:07
state board,The State Board of Refrigeration Examiners -- Note added 9/15/15 17:47
division vocational,Division of Vocational Rehabilitation - Florida Department of Education -- Note added 7/1/15 18:43
rhode island,Rhode Island Clean Water Finance Agency -- Note added 1/27/14 19:35
rhode island,Rhode Island Emissions and Safety Testing -- Note added 1/7/14 18:45
rhode island,Rhode Island Lottery -- Note added 6/7/13 18:46
rhode island,Rhode Island Public Utilities Commission -- Note added 1/29/14 15:24
rhode island,Rhode Island Turnpike and Bridge Authority -- Note added 1/27/14 15:54
office president,"Office of the President, Republic of the Marshall Islands -- Note added 6/12/13 13:31"
safemt resource,"SafeMT, a resource of the Montana State Fund for safety in Montana's workplaces. -- Note added 11/18/13 16:35"
safe law,NC Safe Haven Law - Abandoned Infant Protection Law Site -- Note added 9/15/15 17:54
website virginia,"The website of the Virginia Center on Aging (VCoA), a statewide agency created by the Virginia General Assembly and housed at Virginia Commonwealth University in the School of Allied Health Professions. VCoA works to protect and improve the quality of life of older Virginians, so that they might remain interdependent and contributing members to life in Virginia. -- Note added 6/27/14 14:23"
santee cooper,"Santee Cooper, also known officially from the 1930s as the South Carolina Public Service Authority, is South Carolina's state-owned electric and water utility that came into being during the New Deal. -- Note added 8/25/14 16:04"
new mexico,New Mexico Office of the State Auditor -- Note added 7/16/14 5:38
save water,Save Water NC -- Note added 11/12/15 12:34
florida state,"Florida State Board of Administration, created by the Florida Constitution and is governed by a three-member Board of Trustees (Trustees), comprised of the Governor as Chair, the Chief Financial Officer and the Attorney General. -- Note added 8/25/14 16:59"
washington state,Washington State Board for Community and Technical Colleges -- Note added 4/8/14 18:22
state college,"State College Borough Water Authority, PA -- Note added 10/1/14 20:16"
dept commerce,SC dept of commerce -- Note added 8/28/15 15:19
judicial courts,SC judicial courts -- Note added 8/28/15 15:19
dmv note,SC DMV -- Note added 8/28/15 15:20
south carolina,South Carolina Education Lottery -- Note added 6/12/13 14:24
south carolina,South Carolina Emergency Management Division -- Note added 8/28/15 15:20
early childhood,SC early childhood education program -- Note added 8/28/15 15:20
gov mansion,SC Gov Mansion  -- Note added 8/28/15 15:23
govoners school,SC govoners school for science and math -- Note added 8/28/15 15:23
national guard,SC National Guard -- Note added 8/28/15 15:24
state council,"The State Council of Higher Education for Virginia (SCHEV) makes higher education public policy recommendations to the Governor and General Assembly in such areas as capital and operating budget planning, enrollment projections, institutional technology needs, and student financial aid. -- Note added 6/27/14 14:25"
school planning,"School Planning Section, North Carolina Department of Public Instruction -- Note added 8/25/14 15:01"
south carolina,South Carolina Independent Living Council (SCILC) -- Note added 9/22/15 15:16
south carolina,South Carolina Independent Living Council (SCILC) -- Note added 9/22/15 15:17
south carolina,"The South Carolina EPSCoR/IDeA Program, CCCR COBRE, and the USC School of Medicine Instrumentation Resource Facility -- Note added 8/28/15 15:28"
malpractice patient,SC malpractice patient compensation fund -- Note added 8/28/15 15:27
south carolina,South Carolina School for the Deaf and Blind -- Note added 8/25/14 15:03
south carolina,South Carolina Statewide Independent Living Council (SILC) -- Note added 9/22/15 15:19
sec state,SC sec of state -- Note added 8/28/15 15:29
south carolina,South Carolina Department of Revenue -- Note added 8/25/14 15:04
south carolina,South Carolina Higher EducationTuition Grants Commission -- Note added 8/28/15 15:30
state election,SC State Election Committee -- Note added 8/28/15 15:30
vocab rehab,SC Vocab Rehab -- Note added 8/28/15 15:31
south dakota,South Dakota Department of Transportation -- Note added 7/17/14 5:53
south dakota,South Dakota Housing Development Authority -- Note added 7/17/14 5:54
state employees,STATE EMPLOYEES ASSOCIATION OF NORTH CAROLINA -- Note added 9/15/15 17:56
seeking michigan,"Seeking Michigan, the online platform for the http://michigan.gov/mhc Michigan Historical Center. It includes http://www.michigan.gov/archivesofmi Archives of Michigan research guides and indexes, a blog, and educator resources&ndash;all from the Michigan Historical Center and Archives of Michigan staff. -- Note added 7/9/14 12:06"
minnesota senate,Minnesota Senate -- Note added 11/9/15 20:36
authorized service,"Authorized Service Website for the Arizona Department of Transportation, Motor Vehicle Division -- Note added 1/10/14 19:17"
mississippi state,Mississippi State Port Authority -- Note added 7/25/14 20:50
north carolina,North Carolina State Health Plan for Teachers and State Employees -- Note added 7/25/14 15:10
sled statewide,SLED (Statewide Library Electronic Doorway) -- Note added 6/6/13 18:08
state laboratory,"State Laboratory of Public Health, NC Division of Public Health -- Note added 7/26/13 15:11"
science museum,"Science Museum of Virginia, located in Richmond, VA -- Note added 7/11/14 18:43"
secretary state,NC Secretary Of State -- Note added 9/15/15 17:58
south carolina,south carolina arts commission -- Note added 8/28/15 15:32
south carolina,south carolina historical society -- Note added 8/28/15 15:32
state public,PA State Public School Building Authority -- Note added 6/7/13 11:53
susquehanna river,"Susquehanna River Basin Commission -¬†The Susquehanna River Basin Compact, was signed into law on December 24, 1970. The Compact, as adopted by the Congress of the United States, and the legislatures of New York State, Pennsylvania and Maryland, provides the mechanism to guide the conservation, development, and administration of the water resources of the vast river basin. -- Note added 6/26/13 16:30"
start squad,"Start Squad, kid's portal to the State Library of North Carolina -- Note added 8/25/14 12:12"
justuswarren heart,North Carolina's Justus-Warren Heart Disease and Stroke Prevention Task Force -- Note added 11/10/15 20:35
stateakus pattern,"*state.ak.us pattern to include Alaska state agencies, such as those at: https://www.google.com/#q=site:state.ak.us  -- Note added 7/8/14 12:25"
statealus pattern,"*state.al.us pattern to include Alabama state agencies, such as those at: https://www.google.com/#q=site:state.al.us  -- Note added 7/8/14 12:26"
statearus pattern,*state.ar.us pattern for State of Arkansas agencies -- Note added 7/17/13 19:01
stateazus pattern,"*state.az.us pattern to include Arizona state agencies, such as those at https://www.google.com/#q=site:state.az.us.  -- Note added 12/13/13 13:17"
statecaus pattern,"*state.ca.us pattern to include California state agencies, such as those at: https://www.google.com/#q=site:state.ca.us  -- Note added 6/27/14 16:14"
included find,"Included to find *.state.co.us pattern to find state websites, such as https://www.google.com/search?q=site%3Astate.co.us  -- Note added 1/14/14 15:07"
stateflus pattern,"*state.fl.us pattern to include Florida state agencies, such as those at: https://www.google.com/#q=site:state.fl.us   -- Note added 6/27/14 16:15"
state website,State of Ga website -- Note added 8/25/15 16:09
state iowa,State of Iowa -- Note added 8/26/15 13:51
pattern stateidus,Pattern for *state.id.us websites -- Note added 7/8/13 19:27
state illinois,State of Illinois -- Note added 7/3/14 17:38
state indiana,state of  Indiana -- Note added 8/27/15 14:57
website note,Ky Website -- Note added 8/27/15 16:57
state library,State Library of Louisiana -- Note added 7/26/13 16:18
mass state,Mass State Website -- Note added 8/26/15 16:22
state website,"State website is at http://www.maryland.gov. state.md.us pattern to include Maryland state agencies, such as those at https://www.google.com/#q=site:state.md.us. -- Note added 7/23/14 16:07"
state maine,state of maine -- Note added 8/27/15 20:01
state michigan,state of michigan -- Note added 9/3/15 16:11
minnesotagov portal,Minnesota.gov portal; 'electronic entry point to Minnesota State government information and services' -- Note added 6/2/15 1:37
state mississippi,State of Mississippi -- Note added 7/8/14 12:53
stateneus pattern,*.state.ne.us pattern to include several state agencies. -- Note added 12/9/13 18:31
state website,NH State Website -- Note added 9/2/15 19:11
httpwwwstatenjus httpwwwnjgov,"http://www.state.nj.us/ and http://www.nj.gov both resolve to the same site. n*state.nj.us pattern to include New Jersey state agencies, such as those at: https://www.google.com/#q=site:state.nj.us  -- Note added 7/8/14 13:04"
state new,State of New Mexico -- Note added 7/16/14 5:42
state ohio,State of Ohio -- Note added 3/27/14 18:36
state website,State of OK website -- Note added 8/28/15 18:27
httpwwwstateorus resolves,"http://www.state.or.us/ resolves to a non-styled version of http://www.oregon.gov/  n*state.or.us pattern included here to find State of Oregon agencies, such as: https://www.google.com/search?q=site:state.or.us -- Note added 7/17/14 17:40"
state note,State of SC  -- Note added 8/28/15 15:35
south dakota,South Dakota State Government Website -- Note added 7/17/14 6:01
official site,Official site of the Tennessee Government -- Note added 6/26/14 13:27
official website,The official website of the Commonwealth of Virginia -- Note added 6/27/14 14:50
state vermont,State of Vermont -- Note added 8/15/14 14:27
state washington,State of Washington -- Note added 11/17/14 6:48
statewius pattern,"*.state.wi.us pattern is included here for various Department-level agencies, such as those at: https://www.google.com/search?q=site%3Astate.wi.us  Requires 'www' to resolve. -- Note added 4/2/14 12:49"
state wyoming,State of Wyoming travel and tourism website -- Note added 7/23/14 5:34
nebraska state,Nebraska State Fair -- Note added 12/6/13 19:53
staten island,"Staten Island Borough President, New York, NY -- Note added 11/20/13 18:23"
division surplus,NC Division of Surplus Property -- Note added 9/15/15 18:02
sustainability connection,NC sustainability connection -- Note added 9/15/15 18:06
welcome dedicated,"Welcome to Teach4NC, dedicated to the recruitment of teaching professionals for public schools in North Carolina. -- Note added 9/15/15 18:19"
tennessee holocaust,Tennessee Holocaust Commission -- Note added 6/26/14 7:22
state bar,State Bar of Texas -- Note added 6/20/14 16:58
tennessee foreign,Tennessee Foreign Language Institute -- Note added 6/26/14 7:21
tennessee housing,Tennessee Housing Development Agency -- Note added 6/26/14 7:19
kentucky cabinet,kentucky cabinet of economic development -- Note added 8/27/15 16:58
texas municipal,Texas Municipal Retirement System (TMRS)  -- Note added 8/18/14 16:14
tennessee district,Tennessee District Attorneys General Conference -- Note added 6/26/14 7:16
tennessee emergency,Tennessee Emergency Management Agency -- Note added 6/26/14 7:15
lottery tennessee,Lottery Tennessee -- Note added 6/12/13 14:26
tennessee national,Tennessee National Guard -- Note added 6/26/14 7:13
tennessee vacation,"Tennessee Vacation, the travel and tourism site for the state of Tennessee -- Note added 8/18/14 15:23"
texas parks,Texas Parks and Wildlife magazine -- Note added 3/20/14 16:35
travel tourism,Travel and Tourism Site for Alaska -- Note added 6/6/13 19:44
travel tourism,Travel and Tourism Site for Iowa -- Note added 6/6/13 19:44
travel tourism,Travel and Tourism Site for Kansas -- Note added 6/6/13 19:44
travel tourism,Travel and Tourism Sites for Nevada -- Note added 6/6/13 19:11
travel tourism,Travel and Tourism Sites for Oklahoma -- Note added 6/6/13 19:11
travel tourism,"Travel and Tourism Site for Oregon, Oregon Tourism Commission -- Note added 7/23/14 16:09"
travel tourism,Travel and Tourism Sites for South Dakota -- Note added 6/6/13 19:11
travel tourism,Travel and Tourism Sites for Texas -- Note added 6/6/13 19:11
travel tourism,Travel and Tourism Sites for Wisconsin -- Note added 6/6/13 19:11
nebraska state,Nebraska State Treasurer -- Note added 12/6/13 20:03
washington tree,Washington Tree Fruit Research Commission -- Note added 11/12/14 6:37
washington state,Washington State Tobacco Settlement Authority -- Note added 4/8/14 18:29
texas lottery,Texas Lottery -- Note added 6/12/13 14:26
university arkansas,"University of Arkansas, Division of AgricultureResearch & Extension, University of Arkansas System Arkansas Cooperative Extension Service -- Note added 12/10/14 7:11"
university alaska,University of Alaska Fairbanks Cooperative Extension Service -- Note added 6/7/13 16:34
university idaho,University of Idaho Extension -- Note added 7/8/13 14:29
virgin islands,U.S. Virgin Islands Bureau of Economic Research -- Note added 8/18/14 14:14
virgin islands,U.S. Virgin Islands Economic Development Authority -- Note added 8/18/14 14:12
university vermont,University of Vermont Extension -- Note added 8/18/14 5:33
university wisconsinextension,University of Wisconsin-Extension -- Note added 8/12/14 5:36
university wyoming,University of Wyoming Cooperative Extension Service -- Note added 7/23/14 5:39
virginia state,Virginia State Rehabilitation Council (SRC) -- Note added 8/27/15 14:12
virginia association,"The Virginia Association of Assessing Officers is a professional organization of assessors and appraisers from state and local governments throughout the Commonwealth. The organization's mission is to improve assessment standards, disseminate information on assessment practices, and provide continuing education to its members. -- Note added 7/11/14 18:56"
virginia board,Virginia Board for People with Disabilities -- Note added 7/11/14 18:57
