Sector,Note
travel tourism,Travel and Tourism Site for Vermont -- Note added 6/6/13 19:19
see historical,See historical snapshot at: http://web.archive.org/web/20080120044716/http://www.1800arkansas.com/  -- Note added 1/24/14 14:38
virginia service,"2-1-1 VIRGINIA is a service of the Virginia Department of Social Services provided in partnership with the Council of Community Services, the Family Resource and Referral Center, The Planning Council, the United Way of Central Virginia, and the United Way of Greater Richmond and Petersburg. -- Note added 5/27/14 14:14"
virginia service,"2-1-1 VIRGINIA is a service of the Virginia Department of Social Services provided in partnership with the Council of Community Services, the Family Resource and Referral Center, The Planning Council, the United Way of Central Virginia, and the United Way of Greater Richmond and Petersburg. -- Note added 1/10/14 19:17"
judicial district,4th Judicial District Attorney -- Note added 1/10/14 19:17
new york,"511 NY (New York State Department of Transportation), the free, official one-stop, all-encompassing telephone and Web service offering  information on transportation services and conditions throughout New York State.  -- Note added 1/24/14 14:34"
state idaho,State of Idaho (mirror website of www.idaho.gov) -- Note added 7/17/14 14:28
alabama cooperative,Alabama Cooperative Extension System -- Note added 6/12/13 16:37
new mexico,New Mexico Cooperative Extension Publications -- Note added 7/25/13 17:38
pennsylvania adoption,Pennsylvania Adoption Exchange -- Note added 6/30/14 15:39
alabama department,Alabama Department of Public Health -- Note added 6/12/13 16:40
university massachusetts,University of Massachusetts Center for Agriculture Research and Extension -- Note added 11/20/13 15:32
texas agrilife,Texas A&M AgriLife Extension -- Note added 3/3/15 6:32
alabama housing,Alabama Housing Finance Authority -- Note added 6/12/13 16:40
alaska housing,Alaska Housing Finance Corporation -- Note added 6/6/13 18:08
alaska industrial,Alaska Industrial Development and Export Authority -- Note added 6/6/13 18:08
department military,Alaska's Department of Military and Veterans Affairs Division of Homeland Security and Emergency Management -- Note added 6/27/14 6:01
alaska aerospace,Alaska Aerospace Corporation (Board of directors appointed by Alaska governor) -- Note added 7/23/14 15:36
alaska energy,Alaska Energy Authority -- Note added 6/6/13 18:08
alaska public,Alaska Public Broadcasting Commission -- Note added 6/6/13 18:08
alaska railroad,Alaska Railroad Corporation -- Note added 6/6/13 18:08
travel tourism,Travel and Tourism Site for Alabama -- Note added 6/6/13 19:22
alabama national,Alabama National Guard Counterdrug Program -- Note added 1/23/14 13:41
alabama film,Alabama Film Office -- Note added 6/12/13 16:42
legal information,"Alabama's Legal Information Center, Alabama Supreme Court and State Law Library Catalog -¬†catalog.alalinc.net and 2.alalinc.net -- Note added 6/12/13 16:43"
alaska railroad,Alaska Railroad Corporation -- Note added 7/2/13 17:55
alaska seafood,Alaska Seafood Marketing Institute -- Note added 6/6/13 18:08
alabama state,Alabama State Board of Medical Examiners (an administrative and regulatory agency of the state of Alabama) and the Medical Licensure Commission of Alabama -- Note added 6/12/13 16:46
alabama board,Alabama Board of Pharmacy -- Note added 6/12/13 16:47
alabama state,Alabama State Department of Education -- Note added 6/12/13 17:15
travel tourism,Travel and Tourism Site for American Samoa -- Note added 6/6/13 19:22
amtrak cascades,"Amtrak Cascades, a train service sponsored by the state departments of transportation of Washington and Oregon. -- Note added 6/17/14 14:40"
agency persons,Agency for Persons with Disabilities (APD) -- Note added 2/25/15 15:33
alaska permanent,Alaska Permanent Fund Corporation -- Note added 6/6/13 18:08
arkansas public,Arkansas Public Service Commission -- Note added 1/10/14 17:55
arbenefitsfor arkansas,ARBenefitsfor Arkansas State and Public School Plan MembersProvided by the Employee Benefit Division of the [Arkansas] Department of Finance & Administration -- Note added 12/10/14 6:24
arkansas fire,Arkansas Fire Protection Licensing Board -- Note added 6/12/13 18:10
arkansas national,Arkansas National Guard -- Note added 1/23/14 13:42
travel tourism,Travel and Tourism Site for Arizona -- Note added 6/6/13 19:16
arizona lottery,Arizona lottery -- Note added 11/18/13 15:03
workforce connection,"Arizona's Workforce Connection!, a website of the Governor's Council on Workforce Policy developed to provide easy access to the workforce development system in Arizona. -- Note added 11/18/13 15:13"
arkansas history,"Arkansas History Commission, a division of the Arkansas Department of Parks and Tourism -- Note added 12/10/14 6:32"
travel tourism,Travel and Tourism Site for Arkansas -- Note added 6/6/13 19:23
arkansas childrens,Arkansas Children's Trust Fund -- Note added 7/17/13 16:07
arkansas department,Arkansas Department of Education -- Note added 12/10/14 6:56
arkansas economic,Arkansas Economic Development Coorporation (AEDC) -- Note added 1/24/14 14:36
arkansas ethics,Arkansas Ethics Commission -- Note added 7/17/13 16:13
arkids first,"ARKids First health insurance, Arkansas Department of Human Services -- Note added 1/10/14 19:17"
arkansas livestock,Arkansas Livestock and Poultry Commission -- Note added 7/17/13 16:14
arkansas state,Arkansas State Medical Board -- Note added 7/17/13 17:16
arkansas state,Arkansas State Board of Optometry -- Note added 11/18/13 15:44
arkansas state,Arkansas State Board of Physical Therapy -- Note added 11/18/13 15:45
arkansas state,Arkansas State Board of Collection Agencies -- Note added 11/18/13 15:45
alabama state,"Alabama State Port Authority, Mobile, AL -- Note added 6/12/13 17:16"
american samoa,American Samoa Territorial Energy Office -- Note added 6/7/13 14:55
new york,New York State Public Service Commission‚Äôs Consumer Web Site -- Note added 1/10/14 19:17
california state,"California State Assembly Democratic Caucus, State of California -- Note added 6/6/13 18:08"
assistive technology,Assistive Technology Loan Fund Authority. The authority offers low interest loans for a variety of special equipment to eligible applicants. See the establishing law at http://law.lis.virginia.gov/authorities/assistive-technology-loan-fund-authority-atlfa  -- Note added 7/23/14 15:46
arizona board,Arizona Board of Behavioral Health Examiners -- Note added 12/11/13 13:50
arizona commerce,Arizona Commerce Authority -- Note added 12/11/13 13:50
arizona state,Arizona State Board of Dental Examiners -- Note added 12/11/13 13:50
arizona state,Arizona State Parks -- Note added 12/11/13 13:51
uss north,"USS North Carolina Battleship, North Carolina Department of Cultural Resources -- Note added 3/20/14 17:19"
village baxter,"Village of Baxter Estates, Port Washington, NY -- Note added 6/8/15 12:11"
north carolina,North Carolina Board of Massage & Bodywork Therapy -- Note added 9/11/15 18:20
museum natural,NC museum of natural sciences  -- Note added 9/11/15 18:50
state connecticut,State of Connecticut Bonds -- Note added 6/27/13 19:52
california humanities,"California Humanities is an independent non-profit partner of the National Endowment for the Humanities,  nthat promotes the humanities in California in order to help create &ldquo;a state of open mind.' -- Note added 3/10/15 15:07"
californiavolunteers state,"CaliforniaVolunteers, the state office that manages programs and initiatives aimed at increasing the number of Californians engaged in service and volunteering -- Note added 11/22/13 14:11"
state independent,CA State Independent Living Counsel advocates for persons with disabilities to enable them to live independently. n  -- Note added 3/5/15 22:35
california state,California State Teachers Retirement System -- Note added 3/9/15 15:17
nebraska state,Nebraska State Capitol -- Note added 12/6/13 19:48
caswell developmental,"Caswell Developmental Center, NC Division of State Operated Healthcare Facilities -- Note added 6/6/13 18:08"
california environmental,"California Environmental Health Tracking Program, California Department of Public Health -- Note added 10/24/14 12:09"
univ kentucky,Univ of Kentucky Extension website -- Note added 8/27/15 16:14
hawaiipacific area,"Hawaii-Pacific Area Combined Federal Campaign - geographic area includes the State of Hawaii, Guam, Northern Marianas Islands, and American Samoa -- Note added 6/12/13 13:14"
tristate cfc,"Tristate CFC, Indiana -- Note added 8/27/15 14:19"
college foundation,"College Foundation of North Carolina, a¬†service of the State¬†of North Carolina -- Note added 7/24/13 16:09"
chesapeake bay,"Chesapeake Bay Program, Restoration of the Chesapeake Bay http://www.chesapeakebay.net -- Note added 11/20/13 16:26"
childrens health,Pennsylvania's Children's Health Insurance Program (CHIP) -- Note added 6/6/13 18:08
maryland department,Maryland Department of Business and Economic Development -- Note added 1/10/14 19:17
connecticut historical,Connecticut Historical SocietyMuseum and Library -- Note added 12/15/14 6:22
statesville note,"statesville, nc -- Note added 9/11/15 19:22"
clemson univ,"Clemson Univ, Sc -- Note added 8/28/15 13:40"
arkansas commission,Arkansas Commission on Law Enforcement Standards and Training -- Note added 7/17/13 18:34
coliseum boulevard,"Coliseum Boulevard Plume (CBP), an area in Montgomery, Alabama, where the groundwater 10-50 feet below land surface contains trichloroethylene (TCE).  Investigation, management, and cleanup of the groundwater is being conducted by the https://www.dot.state.al.us/ Alabama Department of Transportation (ALDOT). -- Note added 9/24/14 16:14"
travel tourism,Travel and Tourism Site for Colorado -- Note added 6/6/13 19:23
colorado lottery,Colorado lottery -- Note added 6/12/13 14:06
colorado call,"Colorado No Call program. A private company, Data Protection Group, operates this site under contract with the Colorado Public Utilities Commission. -- Note added 7/11/14 5:54"
upper colorado,"Upper Colorado River Endangered Fish Recovery Program, U.S. Fish and Wildlife Service -- Note added 7/23/14 13:45"
north carolina,North Carolina DOT Complete Streets -- Note added 1/22/14 18:53
correction enterprises,"Correction Enterprises, North Carolina Department of Public Safety -- Note added 7/24/13 14:00"
louisiana crawfish,Louisiana Crawfish Promotion and Research Board (LCPRB) -- Note added 9/22/15 16:53
georgia superior,Georgia Superior Courts -- Note added 8/25/15 14:44
connecticut state,Connecticut State Treasury Unclaimed Property Owners List -- Note added 12/15/14 6:38
center technology,"Center for Technology at the University at Albany, State University of New York -- Note added 6/29/15 15:02"
connecticut lottery,Connecticut lottery -- Note added 6/12/13 14:06
connecticut state,Connecticut State Library -- Note added 7/26/13 16:15
travel tourism,Travel and Tourism Site for Connecticut -- Note added 6/6/13 19:28
clean water,Clean Water Management Trust Fund  -- Note added 9/11/15 19:49
secretary state,IL Secretary of State -- Note added 7/1/14 20:19
delaware national,Delaware National Guard -- Note added 1/23/14 14:03
division employment,"Division of Employment Security (DES), NC Department of Commerce (NCC) -- Note added 9/22/15 14:15"
massachusetts jobquest,"Massachusetts JobQuest, Massachusetts Deparment of Career Services -- Note added 12/17/14 15:04"
digital maine,"About the Digital Maine Repository The Digital Maine Repository is one of several services of the Maine State Library to facilitate digitization of - and enhanced access to - collections related to Maine history, genealogy, culture and government. The repository was designed to host a variety of media including books, images, maps and documents, as well as audio and video collections.  -- Note added 12/8/16 22:08"
travel tourism,Travel and Tourism Site for Ohio -- Note added 6/6/13 19:30
travel tourism,Travel and Tourism Site for South Carolina -- Note added 6/6/13 19:30
virginia department,Virginia Department of Motor Vehicles -- Note added 6/6/14 20:27
american samoa,American Samoa Department of Education -- Note added 4/4/14 10:58
dept revenue,NC Dept of Revenue -- Note added 9/11/15 19:50
corridor planning,"Driving95 Corridor Planning and Finance Study website, North Carolina Department of Transportation (NCDOT) -- Note added 9/22/15 16:56"
wisconsin national,Wisconsin National Guard Drug Control Program -- Note added 1/23/14 14:03
myeatsmartmovemorecom consumer,myeatsmartmovemore.com is the 'consumer' site and eatsmartmovemorenc.com is the 'program' site. -- Note added 7/24/13 16:22
educational communications,Educational Communications Board of WI -- Note added 8/5/14 5:24
environmental hearing,"Environmental Hearing Board, State of Pennsylvania -- Note added 11/19/13 12:52"
environmental health,Environmental Health Officer Professional Advisory Committee -- Note added 6/14/13 19:13
virginia office,Virginia Office of the State Long-Term Care Ombudsman -- Note added 8/27/15 15:01
washington state,Washington State University ExtensionEnergy Program -- Note added 11/20/14 7:13
energy section,"The Energy Section in the Division of Energy, Mineral and Land Resources  -- Note added 9/11/15 19:55"
illinois office,Illinois Office of Tourism -- Note added 7/1/14 20:35
environmental help,environmental help website of NC -- Note added 9/11/15 19:56
nebraska environmental,Nebraska Environmental Trust -- Note added 12/6/13 19:52
site eastwest,This is a site of the east-west gateway Council of Government in the bi-state St. Louis area. -- Note added 10/1/15 20:20
executive action,Executive Action Team (EXACT) Multilateral Working Group on Water Resources -- Note added 8/19/13 16:18
travel tourism,Travel and tourism site for Washington State -- Note added 6/6/13 19:36
travel tourism,Travel and Tourism Site for Georgia -- Note added 6/6/13 19:36
travel tourism,Travel and tourism site for state of Minnesota hosted by Explore Minnesota Tourism -- Note added 4/26/15 2:33
virginia cooperative,Virginia Cooperative Extension  -- Note added 6/6/14 20:29
washington state,Washington State University Extension -- Note added 11/20/14 7:10
west virginia,West Virginia University Extension Service -- Note added 7/24/14 5:33
iowa state,Iowa State University Extension -- Note added 8/25/15 20:26
university illinois,University of Illinois Extension -- Note added 11/20/13 15:35
new mexico,New Mexico Cooperative Extension Service -- Note added 7/25/13 17:39
oregon state,Oregon State University Extension Service -- Note added 6/20/14 16:52
penn state,Penn State Extension -- Note added 9/30/14 13:18
purdue indiana,Purdue (Indiana) Cooperative Extension -- Note added 7/19/13 13:34
university delaware,University of Delaware Cooperative Extension Service -- Note added 6/7/13 16:52
univ maine,Univ of Maine extension -- Note added 8/27/15 18:13
university minnesota,University of Minnesota Extension -- Note added 12/6/13 16:23
univ note,Univ of NH -- Note added 8/28/15 18:52
university nebraskandashlincoln,University of Nebraska&ndash;Lincoln Extension -- Note added 11/20/13 19:17
utah state,Utah State University extension -- Note added 8/21/14 5:14
state family,OK State Family & Consumer website -- Note added 8/28/15 16:47
florida commission,"The Florida Commission on the Status of Women - The Florida Commission on the Status of Women is a nonpartisan board, statutorily created in 1991, consisting of 22 appointed members. The Commission is administratively housed in the Office of the Attorney General. -- Note added 7/9/15 14:45"
film industry,SC film industry -- Note added 8/28/15 13:47
pennsylvania fish,Pennsylvania Fish and Boat Commission (PFBC) -- Note added 6/7/13 11:30
florida lottery,Florida lottery -- Note added 6/12/13 14:07
florida courts,"Florida Courts - The mission of the judicial branch is to protect rights and liberties, uphold and interpret the law, and provide for the peaceful resolution of disputes. -- Note added 6/17/15 13:01"
florida department,Florida Department of Education -- Note added 6/17/15 13:06
florida governors,Florida Governor's Office -- Note added 6/6/13 18:08
florida office,"Florida Office of Financial Regulation - Key Function: provides regulatory oversight for Florida's financial services providers.  Mission: to protect the citizens of Florida, promote a safe and sound financial marketplace, and contribute to the growth of Florida's economy with smart, efficient and effective regulation of the financial services industry. -- Note added 6/17/15 13:13"
florida office,Florida Office of Insurance Regulation - To promote a stable and competitive insurance market for consumers. -- Note added 6/17/15 13:17
florida national,Florida National Guard Counterdrug.  n   Florida Counterdrup Program - Under this authority our office provides oversight of the FLARNG and FLANG Substance Abuse Prevention Programs.      -- Note added 6/17/15 13:20
florida fish,Florida Fish and Wildlife Conservation Commission -- Note added 7/8/14 12:46
florida redistricting,Florida re-districting website.  House Speaker Will Weatherford and Senate President Don Gaetz called a special session from August 7-15 to amend Congressional Districts 5 and 10 consistent with the Final Judgment issued by the circuit court in Romo v. Detzner and to make conforming changes to districts that are a direct result of the changes to Congressional Districts 5 and 10. -- Note added 6/23/15 18:02
florida environmental,"Florida Environmental Public Health Tracking, Florida Department of Health This web portal was supported by Cooperative Agreement Number 5U38EH000941 from the Centers for Disease Control and Prevention. Its contents are solely the responsibility of the authors (FL Tracking Team) and do not necessarily represent the official views of the Centers for Disease Control and Prevention. -- Note added 7/9/15 15:15"
state unclaimed,"The state of Florida's Unclaimed Property, Florida Treasure Hunt. -- Note added 6/6/13 18:08"
florida water,"Florida Water Permiting Portal This portal provides links to information about water resource permitting in Florida, and links to DEP and the water management districts to: n Apply for permits and other authorizations, including: n Environmental Resource Permits * (and authorizations to use state-owned submerged lands, where applicable) Consumptive and Water Use Permits Well Construction Permits Works of the District Permits    -- Note added 6/23/15 18:21"
florida department,Florida Department of Agriculture and Consumer Services -- Note added 1/10/14 19:03
national government,National Government of the Federated States of Micronesia -- Note added 6/12/13 13:58
georgia national,Georgia National Guard -- Note added 1/23/14 13:59
state georgia,State of Georgia Department of Education -- Note added 6/6/13 18:08
georgia lottery,Georgia lottery -- Note added 6/12/13 14:07
call list,GA Do Not Call List. GA Dept of Law. Consumer Protection Unit.  -- Note added 8/25/15 15:32
georgia state,Georgia State Defense Force -- Note added 1/23/14 14:03
georgia state,Georgia State Defense Force public beta domain. Crosslinked with gasdf.us email domain.
georgia state,Georgia State Defense Force email domain. Referenced on https://directory.doas.ga.gov/. Not in use as a public website.
gear mississippi,"GEAR UP Mississippi operates as part of the Institutions of Higher Learning, Office of Academic and Student Affairs in collaboration with the Mississippi Department of Education, State Board for Community and Junior Colleges and community and national partners. Funding is provided by the United States Department of Education. -- Note added 7/23/14 17:21"
lousiana national,Lousiana National Guard -- Note added 1/22/14 19:28
new mexico,New Mexico Bureau of Geology & Mineral Resources -- Note added 7/16/14 5:13
georgia civil,The Georgia Civil War Commission -- Note added 8/25/15 15:31
georgia fiscal,The Georgia Fiscal Management Council    -- Note added 8/25/15 15:30
georgia trust,Georgia Trust (Preservation Committee) -- Note added 8/25/15 15:28
governors office,Governor's Office of Homeland Security and Emergency Preparedness -- Note added 1/10/14 19:17
oregon student,Oregon Student Access Commission -- Note added 1/10/14 19:17
national fair,Ga National Fair Grounds and Agricenter -- Note added 8/25/15 15:27
georgia commission,Georgia Commission on Dispute Resolution -- Note added 12/5/13 14:15
hawaii tourism,"Hawaii Tourism Authority, Travel and Tourism Site for Hawaii -- Note added 2/10/15 14:00"
pennsylvania fish,Pennsylvania Fish and Boat Commission's Outdoor Shop -- Note added 6/7/13 11:34
got agriculture,"Got to Be NC Agriculture, Goodness Grows in NC, North Carolina Department of Agriculture & Consumer Services -- Note added 6/28/13 16:56"
got festival,"Got To Be NC Festival, a production of the NC Department of Agriculture -- Note added 8/2/13 15:48"
consumer protection,Consumer Protection Division of the Arkansas Attorney General's Office -- Note added 1/10/14 19:17
office governor,"Office of the Governor and Lt. Governor, Commonwealth of the Northern Mariana Islands plus *.gov.mp pattern for other government websites -- Note added 6/7/13 18:59"
govpr pattern,"*.gov.pr pattern for several Puerto Rican government agencies, such as https://www.google.com/#q=site:gov.pr  -- Note added 7/23/14 14:48"
govvi pattern,*.gov.vi pattern for Virgin Island government sites -- Note added 6/7/13 18:57
virginia correctional,"Virginia Correctional Enterprises, a Department of Corrections work program to produce goods and services for agencies of the Commonwealth of Virginia  -- Note added 11/19/13 21:11"
governor phil,"Governor Phil Bryant (Mississippi's 64th governor, 2012-) -- Note added 12/6/13 13:03"
governor morehead,Governor Morehead School for the Blind -- Note added 7/31/13 16:23
office group,"Office of Group Benefits, State of Louisiana -- Note added 9/22/15 17:04"
georgia student,Georgia Student Finance Commission -- Note added 8/25/15 15:25
guam attorney,Guam Attorney General -- Note added 6/7/13 17:47
guam legislature,Guam Legislature -- Note added 6/7/13 17:46
guam department,Guam Department of Revenue and Taxation -- Note added 6/7/13 17:56
official site,Official site of the Washington Dairy Products Commission -- Note added 11/20/14 6:54
hawaii state,Hawaii State Department of Education -- Note added 6/6/13 18:08
village hoffman,"Village of Hoffman Estates, IL -- Note added 7/2/14 18:35"
minnesota house,Minnesota House of Representatives -- Note added 11/9/15 20:35
historical society,Historical Society of New Mexico -- Note added 7/16/14 5:16
michigan state,Michigan State Humanities and Social Services Online -- Note added 9/3/15 15:22
high technology,High Technology Development Corporation. HTDC 'is a state agency established by the Hawaii State Legislature in 1983 to facilitate the development and growth of Hawaii's commercial high technology industry.' -- Note added 6/12/13 13:21
health wellness,NC health and Wellness Trust fund -- Note added 9/11/15 20:19
iowa lottery,Iowa Lottery -- Note added 6/12/13 14:08
university nebraska,University of Nebraska - Lincoln Extension publications -- Note added 11/20/13 19:14
idaho army,Idaho Army National Guard -- Note added 1/23/14 14:03
idaho lottery,Idaho Lottery -- Note added 6/12/13 14:09
ideal idaho,IDeal - Idaho College Savings Program -- Note added 7/8/13 19:00
benefits portal,"Benefits Portal, http://www.in.gov/fssa/ Indiana Family and Social Services Administration -- Note added 11/20/13 19:35"
office illinois,Office of the Illinois State Treasurer -- Note added 7/2/14 18:37
illinois lottery,Illinois Lottery -- Note added 6/12/13 14:09
travel tourism,Travel and Tourism Site for New York -- Note added 6/6/13 19:12
inclusive health,"Inclusive Health, North Carolina Health Insurance Risk Pool, Inc. -- Note added 11/20/13 19:54"
innovate washington,Innovate Washington is hereby created as a state agency exercising public and essential governmental functions. Innovate Washington is created as the successor to the Washington technology center and the Spokane intercollegiate research and technology institute (SIRTI). See http://apps.leg.wa.gov/RCW/default.aspx?cite=43.333&full=true  -- Note added 7/23/14 14:21
guam economic,Guam Economic Development Authority (GEDA) web site. GEDA is an autonomous agency of the Government of Guam and a Guam public corporation. -- Note added 6/7/13 17:59
montana board,Montana Board of Investments -- Note added 11/21/13 14:44
iowa economic,Iowa Economic Development Authority -- Note added 11/21/13 15:05
iowa tribe,"Iowa Tribe of Oklahoma, Perkins, OK -- Note added 11/21/13 15:11"
iowa national,Iowa National Guard -- Note added 1/23/14 14:03
iowa state,Iowa State Fair -- Note added 6/12/13 18:48
north carolina,"The North Carolina Division of Public Health, Injury and Violence Prevention Branch, Youth Suicide Prevention Program works in collaboration with The North Carolina Youth Suicide Prevention Task Force to address youth suicide prevention in North Carolina. -- Note added 11/21/13 20:33"
new jersey,new jersey history site -- Note added 9/16/15 14:49
julian f,Julian F. Keith Alcohol and Drug Abuse Treatment Center. JFK ADATC operates under the authority of the State of North Carolina through the Division of State Operated Healthcare Facilities -- Note added 9/22/15 17:00
department labor,Jobs4Jersey. NJ Department of Labor and Workforce Development. -- Note added 6/6/13 18:08
unified courts,"Unified Courts of Guam, Guam Judiciary - www.justice.gov.gu -- Note added 6/7/13 17:57"
justice administration,"Justice Administration Commission - The Justice Administrative Commission (JAC), created in 1965, provides administrative services on behalf of 49 judicial related entities. -- Note added 6/23/15 19:03"
